{
  "$schema": "http://json-schema.org/draft-04/schema#",
  "id": "http://www.ibm.com/ibm/wdp/property-defs/v1.0/property-defs-schema.json#",
  "title": "Property Definitions Schema",
  "description": "Watson Data Platform Property Definition Schema for the Common Properties editor",
  "type": "object",
  "properties": {
    "current_parameters": {
      "description": "Current parameter set upon input. Keys are parameter names, values are their values.",
      "type": "object",
      "properties": {},
      "required": [],
      "additionalProperties": true
    },
    "parameters": {
      "$ref": "http://www.ibm.com/ibm/wml/operator/v1.0/operator-schema.json#parameters"
    },
    "complex_types": {
      "$ref": "http://www.ibm.com/ibm/wml/operator/v1.0/operator-schema.json#complex_types"
    },
    "uihints": {
      "$ref": "http://www.ibm.com/ibm/wml/uihints/v1.0/uihints-schema.json#"
    },
    "conditions": {
      "$ref": "http://www.ibm.com/ibm/wml/conditions/v1.0/conditions-schema.json#conditions"
    },
    "dataset_metadata": {
      "$ref": "http://www.ibm.com/ibm/wml/dataset-metadata/v1.0/dataset-metadata-schema.json#"
    },
    "resources": {
      "description": "Map of string resources.",
      "type": "object",
      "properties": {},
      "required": [],
      "additionalProperties": true
    }
  },
  "required": [
    "current_parameters",
    "parameters"
  ]
}
